chef_id;recipe_name;data;tags;steps;description;ingredients;n_ingredients
1533;low fat pizza style minute steaks;18/11/2003;['30-minutes-or-less', 'time-to-make', 'course', 'main-ingredient', 'preparation', 'main-dish', 'beef', 'eggs-dairy', 'vegetables', 'cheese', 'stove-top', 'dietary', 'meat', 'steak', 'onions', 'peppers', 'equipment'];['brown steaks in a large oiled skillet over medium high heat about 1 to 2 minutes per side', 'remove from skillet and set aside', 'reduce heat to medium and add 2 tbsps', 'water , green pepper , onion and garlic to skillet', 'cook and stir 2 to 3 minutes', 'stir in pizza sauce and simmer 3 to 5 minutes to blend flavours', 'return steaks and any accumulated juices to skillet and spoon sauce over top', 'sprinkle cheese on top of steaks', 'cover and heat 2 to 3 minutes or until cheese melts', 'serve with pasta and salad or spread slices of toasted italian bread with sauce and top with steaks for an open-faced sandwich'];the popular flavours of beef and pizza combine for an easy meal the entire family will love.;['minute steaks', 'green pepper', 'onion', 'garlic', 'pizza sauce', 'italian cheese blend'];6
4470;heavenly pie;27/07/2002;['weeknight', 'time-to-make', 'course', 'main-ingredient', 'preparation', 'occasion', 'pies-and-tarts', 'desserts', 'eggs-dairy', 'oven', 'easy', 'potluck', 'dinner-party', 'holiday-event', 'pies', 'eggs', 'dietary', 'low-sodium', 'gluten-free', 'free-of-something', 'low-in-something', 'to-go', 'equipment', '4-hours-or-less'];"['whip the egg whites until frothy and then add the cream of tartar , continue beating until the egg whites are very stiff and form peaks', 'gradually beat in the sugar and continue beating until the whites are stiff and glossy spread into a 9"" pie plate and bake in a 250f oven for 1 hour', 'filling: beat the egg yokes until thick', 'gradually beat in the sugar , add lemon juice& rind with the bit of salt', 'cook in a double boiler until thick , stirring constantly', 'whip the cream add a little sugar to the cream , beat until stiff when the crust is completely cooled spread half the whipped cream in the shell , then half the lemon filling , top with remaining whipped cream put in the fridge for 3-4 hours or overnight', 'loosely cover the pie in the fridge']";this is heavenly and a great ;['egg whites', 'cream of tartar', 'white sugar', 'egg yolks', 'sugar', 'lemon juice', 'fresh lemon rind', 'salt', 'whipping cream'];9
5060;potato carrot  salad;15/05/2005;['30-minutes-or-less', 'time-to-make', 'course', 'main-ingredient', 'cuisine', 'preparation', 'occasion', 'north-american', 'salads', 'side-dishes', 'potatoes', 'vegetables', 'canadian', 'potluck', 'picnic', 'dietary', 'carrots', 'brunch', 'to-go', 'camping'];['in a large bowl mix together potatoes , spring onions , red onion , parsley and cheese', 'add pepper and taste , only add a little salt if required , the cheese adds salt', 'add mayonnaise and mix thoroughly', 'spoon into serving dish', 'sprinkle with cayenne and garnish with parsley sprigs', 'refrigerate for at least an hour'];great picnic potato salad, no eggs.;['potatoes', 'green onions', 'red onion', 'carrots', 'parsley', 'parmesan cheese', 'pepper', 'salt', 'mayonnaise', 'cayenne pepper', 'parsley sprigs'];11
5060;cheddar   jack crackers;09/10/2003;['30-minutes-or-less', 'time-to-make', 'course', 'main-ingredient', 'cuisine', 'preparation', 'occasion', 'north-american', 'appetizers', 'lunch', 'snacks', 'eggs-dairy', 'canadian', 'oven', 'dinner-party', 'holiday-event', 'cheese', 'freezer', 'inexpensive', 'british-columbian', 'brunch', 'equipment', 'number-of-servings'];['lightly spoon flour into a dry measuring cup , and level with a knife', 'combine flour and next 5 ingredients in a large bowl , stirring with a whisk', 'cut in butter with a pastry blender or 2 knives until mixture resembles coarse meal', 'add cheese , water and vinegar , stir until mixture just comes together', 'divide dough into 4 equal portions , shaping each into a ball', 'wrap each ball in plastic wrap', 'cover and freeze 30 minutes', 'preheat oven to 375f degrees', 'roll 1 ball into an 8 inch circle on parchment paper , on lightly floured surface', 'sprinkle dough with 1 / 2 teaspoon seeds , and lightly press the seeds into dough', 'cut dough into 8 wedges , do not separate wedges', 'place dough on a large baking sheet', 'repeat procedure with remaining dough and seeds , arranging on 2 baking sheets', 'bake at 375f degrees for 10 minutes or until crackers are brown and crispy', 'cool completely on a wire rack', 'separate into wedges'];these home made crackers are far superior to any you can purchase and go wonderfully with all those great winter soups. also work well as holders of appetizers and use with dips or even alone. we love 'em! adapted from cooking light. 30 minute chill (freeze) time not included in cook or prep time.;['all-purpose flour', 'yellow cornmeal', 'sugar', 'baking soda', 'salt', 'cayenne pepper', 'butter', 'monterey jack and cheddar cheese blend', 'ice water', 'white vinegar', 'poppy seeds'];11
6357;subru uncle s black eyed peas  chauli;16/01/2004;['60-minutes-or-less', 'time-to-make', 'course', 'main-ingredient', 'cuisine', 'preparation', 'occasion', 'lunch', 'beans', 'asian', 'indian', 'dinner-party', 'vegan', 'vegetarian', 'stove-top', 'dietary', 'lentils', 'equipment'];['soak the black eye peas overnight in lots of water', 'drain and keep aside', 'heat oil in a pressure cooker', 'add ginger , garlic , green chillies and onions', 'stir fry until the raw smell of the ginger and garlic is gone and the onions turn reddish brown', 'add turmeric and red chili powders', 'mix well', 'stir fry for 2 minutes', 'add tomatoes an 1 cup of water as well as a little over 1 / 4 cup more of water', 'stir and cook on high flame until the tomatoes are completely tender', 'add salt , mix and cook for 2 minutes', 'toss in the boiled and drained black eye peas', 'stir in 4 cups of water', 'close the lid of the cooker', 'cook on high flame until you hear 4 whistles', 'stir and serve over rice or with indian flatbreads and fat free plain yogurt on the side', 'enjoy !'];i started off 2004 with this recipe (it is believed to be lucky to have black eye peas and rice on jan the 1st!). my brother simply loved this! hope you do too!;['black-eyed peas', 'green chili', 'garlic cloves', 'fresh ginger', 'roma tomatoes', 'salt', 'turmeric powder', 'red chili powder', 'purple onions', 'water', 'olive oil'];11
5060;ethereal lemon pie;10/06/2002;['weeknight', 'time-to-make', 'course', 'main-ingredient', 'cuisine', 'preparation', 'occasion', 'north-american', 'pies-and-tarts', 'desserts', 'eggs-dairy', 'fruit', 'canadian', 'dinner-party', 'heirloom-historical', 'holiday-event', 'kid-friendly', 'romantic', 'cakes', 'pies', 'eggs', 'dietary', 'comfort-food', 'british-columbian', 'taste-mood', '4-hours-or-less'];"['position a rack in the middle of the oven and preheat oven to 225f degrees', 'trace a 9 inch circle on a sheet of parachment paper', 'place the paper on a baking sheet', 'beat the egg whites with an electric mixer on medium speed in a large bowl until foamy', 'increase the speed to medium high and add the cream of tartar and salt , and beat just until the egg whites form soft peaks', 'add the granulated sugar , about 2 tablespoons at a time , and continue beating just until stiff peaks are formed', 'spoon the meringue into a pastry bag fitted with a large star', 'starting at the outside edge of the circle traced on the partachment paper , pipe the meringue into a spiral to fill the circle', 'holding the pastry bag upright and starting at the outer edge of the meringue , pipe 1 tier of rosettes along the edge to make a rim , then pipe a second tier or rosettes on the shoulders of the first tier', ""or , if you don't have a pastry bag , spoon the meringue in circle scooping the sides upward to form a rim"", 'bake for 1 hour , or until the meringue is dry to touch', 'turn off the oven and leave the meringue in the oven for 2 hours', 'peel off the paper', 'store the meringue , tightly wrapped , if not using immediately', 'just before serving , beat the cream with an electric mixer on high speed in a large bowl just until stiff peaks form', 'beat in the lemon curd just until combined well', ""spoon the lemon filling into the meringue shell , arrange the berries on top and lightly sift confectioners' sugar over the berries"", 'serve immediately']";very special, melt in your mouth heaven!!!;"['egg whites', 'cream of tartar', 'salt', 'granulated sugar', 'heavy whipping cream', 'lemon curd', 'berries', ""confectioners' sugar""]";8
3288;citrus ginger dump chicken;14/07/2007;['60-minutes-or-less', 'time-to-make', 'course', 'main-ingredient', 'cuisine', 'preparation', 'north-american', '5-ingredients-or-less', 'main-dish', 'poultry', 'american', 'easy', 'chicken', 'oamc-freezer-make-ahead', 'meat', 'chicken-thighs-legs', 'number-of-servings'];['for immediate cooking: preheat oven to 350 place all ingredients into a prepared baking dish , turn chicken to coat', 'bake until chicken juices run clear - about 45-60 minutes for chicken pieces , or 20-30 minutes for chicken breasts', 'for freezing: place all ingredients into a 1 gallon freezer bag', 'lay flat in freezer', 'to cook from the freezer: thaw in the refrigerator', 'preheat the oven to 350', 'empty the contents of the bag into a large baking dish and bake until the juices run clear see above cooking times'];another freezable idea for a quick meal without much work!  make it now and eat it or save it in the freezer for later :);['chicken pieces', 'pineapple-orange marmalade', 'honey mustard', 'ground ginger', 'red pepper'];5
1533;spinach   artichoke casseroles;29/05/2002;['60-minutes-or-less', 'time-to-make', 'course', 'main-ingredient', 'preparation', 'casseroles', 'main-dish', 'eggs-dairy', 'vegetables', 'oven', 'vegetarian', 'cheese', 'dietary', 'equipment'];['if frozen artichokes are used , cook according to instructions', 'do not overcook', 'drain the artichokes , and place them on bottom of a 3-quart casserole', 'squeeze as much moisture as possible from the spinach , and layer it on top of the artichokes', 'in an electric mixer blend the cream cheese , mayonnaise , and butter or oil until light and fluffy', 'gradually beat in the milk , and spread this mixture over the top of the spinach', 'sprinkle with pepper and the cheese', 'bake , uncovered , at 375 degrees for 40 minutes , or until the top is lightly browned', 'you can refrigerate this dish after putting it together and before baking it , but if it is chilled , slightly increase the baking time'];my friend grace made this for us and it was great. hope you like it.;['artichoke hearts', 'spinach', 'cream cheese', 'mayonnaise', 'butter', 'milk', 'pepper', 'parmesan cheese'];8
4470;danish omelet;31/08/2001;['danish', '60-minutes-or-less', 'time-to-make', 'course', 'main-ingredient', 'cuisine', 'preparation', 'occasion', 'omelets-and-frittatas', 'breakfast', 'lunch', 'main-dish', 'eggs-dairy', 'pork', 'scandinavian', 'european', 'heirloom-historical', 'holiday-event', 'eggs', 'stove-top', 'dietary', 'low-sodium', 'low-calorie', 'low-carb', 'low-in-something', 'meat', 'brunch', 'equipment'];['fry the pork until golden brown', 'remove from fry pan', 'pour off half the drippings', 'mix flour with the milk until smooth', 'add eggs , salt& pepper , beat well', 'pour egg mixture into the fry pan', 'arrange the pork and tomatoes on top of the egg mixture', 'cook for about 10 min , lifting the edges to allow egg mixture to run underneath', 'cook until the omelette is set but still moist on top', 'sprinkle with chives& serve'];this was a regular sat night dinner served with good crusty bread. it has a heavier texture than a french omelet, more like a frittata. good for lunch or brunch   i often use  slivered ham steak  on top instead of the bacon or the streaky pork - just a bit less fat;['pork', 'eggs', 'flour', 'milk', 'salt and pepper', 'chives', 'tomatoes'];7
4470;beets in mustard cream;31/05/2002;['30-minutes-or-less', 'time-to-make', 'course', 'main-ingredient', 'cuisine', 'preparation', 'occasion', 'north-american', 'lunch', 'side-dishes', 'eggs-dairy', 'vegetables', 'canadian', 'refrigerator', 'dinner-party', 'picnic', 'vegetarian', 'stove-top', 'dietary', 'gluten-free', 'free-of-something', 'to-go', 'equipment'];['thoroughly combine mustard , vinegar , salt , & pepper', 'slowly whisk in the olive oil , pouring in a slow steady stream whisking all the while', 'stir in the yogurt to finish the dressing', 'pour the mustard cream over the beets , toss , cover and refrigerate for at least an hour'];wonderful side dish for a bbq or picnic.nice color addition to a buffet;['beet', 'dijon mustard', 'tarragon vinegar', 'salt', 'pepper', 'lite olive oil', 'plain yogurt'];7
5060;pumpkin tea cakes;27/10/2001;['30-minutes-or-less', 'time-to-make', 'course', 'main-ingredient', 'cuisine', 'preparation', 'occasion', 'north-american', 'breads', 'desserts', 'lunch', 'vegetables', 'american', 'canadian', 'oven', 'easy', 'european', 'finger-food', 'heirloom-historical', 'holiday-event', 'kid-friendly', 'cakes', 'english', 'dietary', 'spicy', 'christmas', 'new-years', 'thanksgiving', 'pacific-northwest', 'brown-bag', 'independence-day', 'valentines-day', 'quick-breads', 'taste-mood', 'sweet', 'to-go', 'equipment', 'number-of-servings', 'presentation'];['preheat oven to 350 degrees', 'line 42 miniature muffin cups with 1 1 / 2 inch bon bon papers or small baking cups', 'in a medium bowl , combine oil , egg , sugar , pumpkin and water', 'add flour , baking soda , baking powder , salt , cinnamon , cloves and nutmeg , blend well', 'stir in chopped pecans and dates', 'spoon into paper baking cups , filling almost full', 'top each with a pecan or walnut half', 'bake 15-17 minutes or until a wooden pick inserted in centre comes out clean', 'remove from muffin cups , cool on racks'];nice moist, fragrant, little cakes for afternoon tea or coffee break. spicy pumpkin taste.;['vegetable oil', 'egg', 'sugar', 'canned pumpkin', 'water', 'all-purpose flour', 'baking soda', 'baking powder', 'salt', 'ground cinnamon', 'ground cloves', 'ground nutmeg', 'pecans', 'pitted dates', 'pecan halves'];15
1533;fragrant rice pilaf;13/05/2002;['60-minutes-or-less', 'time-to-make', 'course', 'main-ingredient', 'preparation', 'occasion', 'side-dishes', 'rice', 'vegan', 'vegetarian', 'stove-top', 'dietary', 'spicy', 'pasta-rice-and-grains', 'taste-mood', 'equipment'];['rinse the rice , until the water runs clear', 'put the rice in a bowl , cover with the water and set aside to soak , soak 30 minutes', 'in a large saucepan or dutch oven , heat the oil and toast all the spices for one minute', 'drain the rice and add to the pan', 'cook 3 minutes , stirring frequently , until opaque and lightly golden', 'add 5 cups of water', 'bring to a boil , lower heat , cover , and simmer for about 15 minutes', 'you may need to add additional water or cook a bit longer for the rice to get soft', 'when the rice is served , remind diners that the whole spices are for decoration , not eating'];from, the book of curries & indian foods;['basmati rice', 'water', 'vegetable oil', 'cloves', 'black cardamom pods', 'bay leaves', 'cinnamon sticks', 'black peppercorns', 'cumin seeds', 'coriander seeds', 'salt', 'cilantro'];12
3288;pork  black bean and sweet potato stew pressure cooker;03/01/2003;['60-minutes-or-less', 'time-to-make', 'course', 'main-ingredient', 'cuisine', 'preparation', 'occasion', 'north-american', 'healthy', 'main-dish', 'pork', 'vegetables', 'american', 'easy', 'fall', 'winter', 'stews', 'pressure-cooker', 'stove-top', 'dietary', 'one-dish-meal', 'low-sodium', 'seasonal', 'comfort-food', 'low-in-something', 'meat', 'taste-mood', 'equipment'];"['cover beans with 2"" water in large saucepan and heat to boiling', 'let boil , uncovered , 2-3 minutes', 'remove from heat , cover and set aside for at least 1 hour and up to 4 hours', 'drain soaking water and rinse', 'cut pork roast into 6 slices , 1 1 / 2-2"" thick', 'cut slices into halves', 'saut pork , onion , and garlic in oil in pressure cooker over medium heat until browned , about 10 minutes', 'stir in beans and remaining ingredients , except sweet potatoes', 'close and seal lid', ""cook 12 minutes at 15 pounds pressure , according to manufacturer's directions"", 'immediately cool cooker under cold water and open lid', 'add sweet potatoes to pressure cooker', 'close and seal lid', 'cook at 15 pounds pressure until sweet potatoes are tender , 2-3 minutes', 'immediately cool cooker under cold water and open lid']";this recipe comes from the bean education & awareness network. using your pressure cooker this meal will be ready in a matter of minutes, 15 to be exact! pork, sweet potatoes, beans, brown sugar and mustard all blend in for a unique taste sensation;['dried black beans', 'lean pork loin', 'onion', 'garlic', 'olive oil', 'orange juice', 'light brown sugar', 'dijon-style mustard', 'sweet potatoes'];9
4470;pasta with mushroom garlic sauce;19/09/2001;['30-minutes-or-less', 'time-to-make', 'course', 'main-ingredient', 'cuisine', 'preparation', 'occasion', 'north-american', 'lunch', 'main-dish', 'pasta', 'vegetables', 'canadian', 'easy', 'dinner-party', 'vegetarian', 'dietary', 'one-dish-meal', 'low-sodium', 'comfort-food', 'low-in-something', 'pasta-rice-and-grains', 'taste-mood'];['in a skillet melt 2 tbsp butter', 'add garlic , allow to brown , then add mushrooms , basil , salt& pepper', 'cook until the mushrooms are just tender', 'add remaining butter and olive oil', 'stir and remove from heat', 'when pasta is cooked reheat the sauce add parsley', 'mix with pasta and enjoy'];this recipe is for garlic lovers.it is a quick easy meal when you are rushed and want some comfort food;['linguine', 'butter', 'garlic', 'mushrooms', 'dried basil', 'salt', 'pepper', 'olive oil', 'fresh parsley', 'parmesan cheese'];10
8688;tortellini with  white wine primavera;18/12/2005;['60-minutes-or-less', 'time-to-make', 'course', 'main-ingredient', 'preparation', 'occasion', 'main-dish', 'pasta', 'dinner-party', 'dietary', 'pasta-rice-and-grains', 'ravioli-tortellini', 'brunch'];"['set a pot of the water on high heat to boil , add a pinch or two of salt', 'when the water begins to simmer , set a large saut pan on med-high heat with the oil in it', ""when the water boils , add the tortellini's to the water and set the timer for 7 minutes"", 'by now the oil should be ready', 'add the peppers , zucchini , scallions , asparagus , and garlic to the oil and stir , evenly coating the vegetables', 'saut for about two minutes', 'add the tomatoes , salt , pepper , and italian seasoning', 'saut for another minute or two , or until the tomatoes are beginning to get soft', 'add the wine and reduce until most of the wine has evaporated , leaving enough to coat the vegetables and a little extra for the pasta', 'set the pan aside and cover to keep it hot', 'the timer should have gone off for the tortellini', 'check it by tasting one , if it feels a little tough to chew , it needs a little more time', 'strain the tortellini well , then add it to pan , stirring over low heat for about a minute to absorb some of the sauce', 'serve in a large bowl and sprinkle the parmesan cheese liberally over top', 'garnish with the parsley sprigs , or sprinkle freshly chopped or dried parsley over and around the bowl', 'if you have made crustinies , placing a few around the bowl adds a nice touch']";who does not like pasta?? we love it, and especially prepared this way, yummy and good for you! cooks notes:  feel free to alter quantities to suit your tastes, or what veggies are in season.;['cheese tortellini', 'plum tomatoes', 'green bell pepper', 'red bell pepper', 'scallion', 'asparagus', 'fresh garlic', 'green zucchini', 'white wine', 'salt', 'ground black pepper', 'italian seasoning', 'olive oil', 'parmesan cheese', 'fresh parsley', 'water'];16
3288;instant spinach mashed potatoes;18/06/2006;['bacon', '30-minutes-or-less', 'time-to-make', 'course', 'main-ingredient', 'cuisine', 'preparation', 'north-american', 'side-dishes', 'pork', 'potatoes', 'vegetables', 'american', 'stove-top', 'meat', 'greens', 'spinach', 'equipment'];['in a saucepan , combine spinach , 1 / 4 cup of water and 1 tsp salt', 'cook , covered 10 minutes or until tender', 'drain well', 'in a saucepan combine 1 1 / 3 cups water with milk and margarine with 1 / 2 tsp salt', 'bring to boiling and remove from heat', 'stir in potato flakes', 'stir together cooked spinach , potato mixture and bacon pieces', 'turn mixture into a 1 quart baking dish', 'sprinkle with cheese', 'place under broiler for 1-2 minutes or till cheese melts'];there are several recipes here using potatoes and mashing them for a similar dish but sometimes you don't have the time to make something that looks this good!  here is a quickie substitute for a taste good, looks good dish;['frozen chopped spinach', 'water', 'salt', '2% low-fat milk', 'margarine', 'instant mashed potatoes', 'cooked bacon', 'cheddar cheese'];8
5060;potatoes in green beans;08/11/2001;['30-minutes-or-less', 'time-to-make', 'course', 'main-ingredient', 'cuisine', 'preparation', 'occasion', 'north-american', 'lunch', 'main-dish', 'side-dishes', 'potatoes', 'vegetables', 'american', 'canadian', 'easy', 'stove-top', 'dietary', 'comfort-food', 'pacific-northwest', 'green-yellow-beans', 'taste-mood', 'equipment'];['in a frypan , heat oil , cook onions and potatoes over medium high heat until golden', 'add beans', 'combine vinegar , sugar , mustard and 2 tablespoons water', 'pour over bean mixture', 'cook until moisture is almost gone , stirring occasionally', 'season with salt and pepper', 'garnish with parsley'];easy nice combination.;['red potatoes', 'onion', 'olive oil', 'green beans', 'cider vinegar', 'sugar', 'dry mustard', 'water', 'salt and pepper'];9
3288;breakfast burrito sandwich maker;24/07/2002;['30-minutes-or-less', 'time-to-make', 'course', 'main-ingredient', 'cuisine', 'preparation', 'occasion', 'north-american', 'for-1-or-2', 'breakfast', 'lunch', 'main-dish', 'eggs-dairy', 'vegetables', 'american', 'easy', 'beginner-cook', 'finger-food', 'kid-friendly', 'cheese', 'eggs', 'dietary', 'one-dish-meal', 'sandwiches', 'equipment', 'number-of-servings', 'presentation', '3-steps-or-less'];['take small soft shell burrito and fill with scrabbled egg , shredded cheese , chopped peppers& onions , , use what ever you like even shredded potatoes in the dairy section', 'now place in the iron and fold over the sides and then the ends and place the top on', 'cook to your liking and you will notice that the pocket stays sealed'];i found this recipe on a camping site and thought it would work just great with a pudgie pie maker or sandwich maker. easy, fast to put together and run for work or school;['flour tortilla', 'egg', 'cheese', 'bell pepper', 'onion', 'salsa', 'potato'];7
1533;summer beans with marinated mozzarella and cherry tomatoes;22/04/2005;['30-minutes-or-less', 'time-to-make', 'course', 'main-ingredient', 'cuisine', 'preparation', 'occasion', 'north-american', 'salads', 'side-dishes', 'eggs-dairy', 'vegetables', 'canadian', 'refrigerator', 'dinner-party', 'summer', 'cheese', 'stove-top', 'dietary', 'spicy', 'seasonal', 'ontario', 'green-yellow-beans', 'tomatoes', 'taste-mood', 'equipment', 'presentation', 'served-cold'];['in a medium-size bowl , toss the shallots with vinegar', 'add cubed mozzarella , herbs and oil', 'toss well to coat , season with salt and pepper and marinate for a few hours or overnight to let flavors blend', 'bring a medium-size pot of water to a boil and add 1 / 2-teaspoon salt', 'drop in the beans and cook until just tender , 1 to 2 minutes for small young beans and up to 6 minutes for larger beans', 'drain', 'toss the hot beans with the olive oil , shallots , tarragon , 1 / 2-teaspoon salt and pepper', 'the beans will soak up the flavors as they cool to room temperature', 'toss in the cherry tomatoes', 'season and drizzle with additional oil and vinegar if desired'];we made this a few times last summer, i just got some fresh green and  yellow beans..so i did a combo..turned out great.;['shallots', 'red wine vinegar', 'mozzarella cheese', 'fresh herbs', 'extra virgin olive oil', 'salt & freshly ground black pepper', 'green beans', 'cherry tomatoes'];8
8688;bloody mary   by the pitcher;14/01/2005;['15-minutes-or-less', 'time-to-make', 'course', 'preparation', 'occasion', 'beverages', 'easy', 'dinner-party', 'cocktails', 'spicy', 'taste-mood'];['combine tomato juice , clamato juice and vodka in a large pitcher and stir to blend', 'add remaining ingredients and stir with a wooden spoon until all is well blended', 'taste , then add hot sauce depending on how spicy you like your bloody mary', 'on a small plate , combine coarse salt and old bay seasoning', 'run a lemon or lime slice around the rim of your glass , then dip the rim into the old bay / salt mixture', 'add ice to your glass and pour in the bloody mary mixture', 'garnish with desired items'];my husband brought this recipe to me from our local paper last weekend. he is a bloody mary lover and i wouldn't want this one to get away. dan'l says this recipe is a winner!!  why make one glass, when you can make a pitcher full? this recipe makes 4-5 pint sized servings.;['tomato juice', 'clamato juice', 'vodka', 'prepared horseradish', 'worcestershire sauce', 'soy sauce', 'wasabi powder', 'celery salt', 'lemon, juice of', 'lime, juice of', 'hot sauce', 'coarse salt', 'old bay seasoning', 'celery', 'cucumber', 'lemon slices'];16
