chef_id;recipe_name;data;tags;steps;description;ingredients;n_ingredients
6357;former  miss india  manpreet brar s garlic mushrooms;26/02/2003;['60-minutes-or-less', 'time-to-make', 'course', 'main-ingredient', 'cuisine', 'preparation', 'occasion', 'for-1-or-2', 'low-protein', 'lunch', 'vegetables', 'french', 'european', 'romantic', 'vegetarian', 'stove-top', 'dietary', 'low-sodium', 'low-cholesterol', 'low-saturated-fat', 'low-calorie', 'low-carb', 'mushrooms', 'low-in-something', 'taste-mood', 'equipment', 'number-of-servings'];['remove the stems of the mushrooms and keep aside', 'heat oil in a pan', 'add garlic and stir-fry till the raw smell is gone', 'add mushrooms , salt to taste , red wine / sherry and mix well', 'cover', 'simmer on low flame for 20 minutes till the mushrooms are golden brown', 'sprinkle with freshly ground black pepper', 'garnish with freshly chopped parsley', 'serve immediately'];"former ""miss india"", model and anchor manpreet brar was the ""guest of the week"" today(and for this week) on mirch masala, star plus. i'm sure all those who watched the show have learnt this - manpreet said that she is a vegetarian, eats alot(she wont step out of the house without a 3 egg omelette!) and exercises. that is the key to her fitness and great shape,) she said she loves to make snacks and desserts because these are quick and easy to fix foods which she likes because she doesnt like spending too long over the stove:) she spoke well, looked incredible and shared this recipe with the viewers. she said she makes this whenever her friends' drop in and now she has to find a new snack to please them:) i haven't tried these, but i can bet these are very good.";['extra virgin olive oil', 'garlic', 'mushrooms', 'salt', 'red wine', 'fresh ground black pepper', 'parsley'];7
4470;pochero;05/12/2001;['60-minutes-or-less', 'time-to-make', 'course', 'main-ingredient', 'cuisine', 'preparation', 'occasion', 'yams-sweet-potatoes', 'main-dish', 'soups-stews', 'beans', 'pork', 'potatoes', 'poultry', 'vegetables', 'asian', 'holiday-event', 'stews', 'chicken', 'stove-top', 'filipino', 'dietary', 'one-dish-meal', 'comfort-food', 'low-carb', 'chick-peas-garbanzos', 'low-in-something', 'meat', 'taste-mood', 'equipment'];['wash chick peas and soak overnight', 'in one pan put in the chick peas chicken , pork , chorizo and add water to cover', 'add sliced onion , salt& peppercorns , bring to a boil', 'reduce heat and simmer until meats and chick peas are almost tender', 'in another pan heat oil and fry garlic with the chopped onion on low heat , stirring frequently until golden brown', 'add tomatoes and cook to a pulp', 'add meats , stock& sweet potatoes', 'simmer until potatoes are nearly cooked then add cabbage& green onions for the last few minutes', 'serve broth as soup and the meats& vegetables as a separate course'];great two course meal from one pot rather like the french ;['chickpeas', 'chicken', 'pork', 'chorizo sausage', 'onion', 'salt', 'whole black peppercorn', 'oil', 'garlic', 'tomatoes', 'sweet potato', 'bok choy', 'green onions'];13
5060;baked leek and tomato;21/12/2004;['60-minutes-or-less', 'time-to-make', 'course', 'main-ingredient', 'cuisine', 'preparation', 'occasion', 'north-american', 'for-1-or-2', 'side-dishes', 'vegetables', 'canadian', 'easy', 'beginner-cook', 'dinner-party', 'dietary', 'inexpensive', 'british-columbian', 'tomatoes', 'brunch', 'number-of-servings'];['preheat oven to 400f degrees', 'spray an oven proof gratin dish with veggie spray', 'cover bottom of dish with half the leek slices and layer half the tomato slices over to cover', 'sprinkle with salt and pepper to taste', 'sprinkle half the olive oil over all', 'make a second layer , ending with the tomato slices , salt and pepper and olive oil', 'top with jalapeno and sprinkle with shredded cheddar cheese', 'bake , uncovered , in 400f oven for 30 minutes'];nice zesty side dish with a little jalapeno added. (i just happened to have yellow and orange tomatoes on hand, it's ok to use all red or all of any colour or any combination.);['vegetable oil cooking spray', 'tomatoes', 'yellow tomatoes', 'leek', 'jalapeno pepper', 'salt and pepper', 'olive oil', 'sharp cheddar cheese'];8
5060;crab asparagus lettuce rolls;09/06/2003;['30-minutes-or-less', 'time-to-make', 'course', 'main-ingredient', 'cuisine', 'preparation', 'occasion', 'north-american', 'appetizers', 'main-dish', 'salads', 'side-dishes', 'fruit', 'seafood', 'vegetables', 'canadian', 'refrigerator', 'dinner-party', 'finger-food', 'nuts', 'crab', 'food-processor-blender', 'dietary', 'british-columbian', 'shellfish', 'asparagus', 'greens', 'lettuces', 'brunch', 'equipment', 'small-appliance', 'presentation', 'served-cold'];['combine all dressing ingredients in food processor or blender', 'blend until smooth and the consistency of a mayonnaise based dip', 'cover and set aside in the refrigerator', 'pour the pecan halves on a tray and toast , 7 or 8 minutes', 'remove from oven and sprinkle with kosher salt and cayenne pepper to taste', 'set aside to cool , when cool , coarse chop 1 / 4 cup , leave the rest whole', 'break tough ends off asparagus', 'steam for 3 minutes , just until tender crisp , there should be lots of crunch left', 'plunge into ice water', 'slice all but 12 spears into 1 / 4 inch pieces', 'scrape the carrots and grate , seed and dice the tomatoes', 'rinse the crabmeat and thourghly dry on paper towel , squeezing out the moisture', 'combine crabmeat , chopped asparagus , grated carrots , diced tomatoes , chopped pecans , dried dill weed , salt and cayenne pepper', 'mix well', 'add 1 / 2 of the dressing to the crabmeat mixture', 'use only enough dressing to hold the mixture together', 'the mixture should be fairly dry , not runny', 'reserve the rest of the dressing to use as a dip for the lettuce rolls', 'wash and separate lettuce leaves , dry as much as possible , best dried in a spinner', 'place 1 to 2 tablespoons of crabmeat mixture in lettuce cup and roll as tightly as possible appetizer size , use toothpicks if necessary , or leave open if you wish', 'repeat until all filling mixture is used', 'place on serving platter and sprinkle with grated parmesan cheese , if using', 'place a pecan half on top of each roll', 'garnish the platter with more pecan halves and the 12 reserved asparagus spears', 'serve chilled at least one hour', 'the lettuce rolls can be made larger for luncheon use etc', ', or they can be served with crabmeat mixture in a bowl and the lettuce cups separate for each diner to fill themselves , serve extra asparagus and pecan halves on the side'];can be made small for appetizer or larger for luncheon or serve mix and lettuce cups separately for the diner to put together. entry for rsc spring. (chill time 1 hour).;['crabmeat', 'asparagus', 'carrots', 'fresh tomatoes', 'dried dill weed', 'salt', 'cayenne pepper', 'lettuce leaf', 'pecan halves', 'kosher salt', 'parmesan cheese', 'ricotta cheese', 'cucumber-dill salad dressing', 'sesame oil', 'lemon, juice of'];15
3288;grilled portabella mushrooms and veggie fajitas;08/12/2002;['60-minutes-or-less', 'time-to-make', 'course', 'main-ingredient', 'cuisine', 'preparation', 'occasion', 'north-american', 'low-protein', 'lunch', 'main-dish', 'vegetables', 'mexican', 'oven', 'barbecue', 'easy', 'finger-food', 'picnic', 'spring', 'summer', 'vegan', 'vegetarian', 'broil', 'dietary', 'low-cholesterol', 'seasonal', 'low-saturated-fat', 'low-calorie', 'mushrooms', 'healthy-2', 'low-in-something', 'to-go', 'equipment', 'grilling', 'presentation'];['in a large bowl , place the vinegar , olive oil , parsley , garlic , salt , and pepper , and whisk well to combine', 'add all of the vegetables and toss well to thoroughly coat the vegetables with the marinade', 'set the vegetables aside and allow them to marinate for 15 minutes', 'place the vegetables on a hot grill and grill for 3-5 minutes per side or until tender', 'transfer the grilled vegetables to a cutting board and cut them into strips', 'the tortillas can be warmed on the grill , if desired', 'transfer the vegetables to a platter for service', 'allow guests to build their own fajitas by filling tortillas with the grilled vegetables and top with your favorite sauce if desired'];got this recipe from the vegan chef. it is wonderful...even your non veg guests and family will love it.;['balsamic vinegar', 'olive oil', 'parsley', 'garlic', 'salt', 'fresh ground black pepper', 'portabella mushrooms', 'red onions', 'red peppers', 'green peppers', 'jalapeno peppers', 'flour tortillas'];12
8688;fajita salad;21/03/2003;['weeknight', 'time-to-make', 'course', 'main-ingredient', 'preparation', 'main-dish', 'salads', 'beans', 'beef', 'eggs-dairy', 'vegetables', 'easy', 'cheese', 'stove-top', 'one-dish-meal', 'black-beans', 'meat', 'steak', 'greens', 'lettuces', 'equipment', 'number-of-servings', '4-hours-or-less'];['combine ingredients for dressing in a small bowl', 'remove 1 / 4 cup for marinating flank steak', 'set aside', 'marinate steak in 1 / 4 cup dressing for at least 15 minutes or up to 2 hours', 'chill if marinating the steak longer than 30 minutes , otherwise it may be marinated at room temperature', 'prepare ingredients for salad , keeping components separate', 'heat oil for searing the steak in a large nonstick skillet over high heat', 'remove steak from marinade', 'season with salt and pepper', 'sear steak on both sides until medium-rare , 3-4 minutes per side', 'transfer meat to a cutting board and let rest 5 minutes , then thinly slice steak against the grain with a sharp knife', 'to assemble , layer half the greens in a deep glass bowl', 'on the lettuce , layer half of each of the tomatoes , cheese , chips , beans , cilantro , scallions , and steak slices', 'drizzle with half the dressing , then layer the rest of the ingredients', 'pile the other half of the steak slices in the center , and drizzle remaining dressing on top', 'garnish with a dollop of sour cream and serve', 'makes about 10 cups'];this makes a beautiful layered fajita salad. arrange the ingredients in a glass bowl - to show off the tiers. very simple yet elegant. from cuisine.;['ketchup', 'fresh lime juice', 'honey', 'yellow onions', 'vegetable oil', 'water', 'chipotle chile in adobo', 'ground cumin', 'salt', 'flank steak', 'romaine lettuce', 'grape tomatoes', 'cheddar cheese', 'corn chips', 'black beans', 'cilantro leaf', 'scallion', 'sour cream'];18
5060;country ribs slow braised in wine  with noodles;16/05/2006;['time-to-make', 'course', 'main-ingredient', 'cuisine', 'preparation', 'occasion', 'north-american', 'main-dish', 'pork', 'canadian', 'comfort-food', 'british-columbian', 'meat', 'pork-ribs', 'pasta-rice-and-grains', 'brunch', 'taste-mood', '4-hours-or-less'];['remove any excess fat from the ribs and season the ribs with salt and fresh ground pepper to taste', 'heat the oil in a large nonstick frypan to hot , add the ribs and brown well on all sides', 'about 5 to 8 minutes', 'remove ribs to a plate and keep warm', 'reduce heat and add wine , deglaze pan , releasing the brown bits', 'mix together in a bowl , the rest of the ingredients for the sauce , except the spinach , reserve for later', 'add to the wine in the frypan', 'stir together and bring to slow simmer then add the browned ribs', 'cover and simmer for 1 hour', 'remove from heat and stir in the spinach', 'in the meantime , cook the noodles according to the package instructions', 'drain well', 'pour ribs and sauce into a large pasta bowl', 'add the drained noodles , carefully stir to combine'];luscious tingly one pot dinner.;['country-style pork ribs', 'salt & pepper', 'olive oil', 'dry white wine', 'chili-garlic sauce', 'onion', 'celery', 'creamed corn', 'balsamic vinegar', 'mustard', 'fresh spinach', 'wide egg noodles'];12
1533;stuffed head lettuce;20/01/2005;['30-minutes-or-less', 'time-to-make', 'course', 'main-ingredient', 'cuisine', 'preparation', 'occasion', 'north-american', 'salads', 'eggs-dairy', 'vegetables', 'canadian', 'easy', 'no-cook', 'refrigerator', 'spring', 'summer', 'cheese', 'dietary', 'seasonal', 'ontario', 'greens', 'lettuces', 'tomatoes', 'equipment', 'presentation', 'served-cold', 'technique'];['wash lettuce', 'remove core', 'with a tablespoon , remove enough of the lettuce around core to leave a cavity 2 to 3 in diameter', 'save removed lettuce for another use', 'combine cheeses , carrot , green pepper , tomato , pepper , salt and onion , pack firmly into lettuce cavity', 'wrap lettuce head in foil or plastic wrap and chill until center is solid', 'slice lettuce into wedges', 'serve with dressing of your choice', 'a few pieces of fresh fruit placed on the salad plate is very nice'];this is so easy and so pretty. it makes a nice summer lunch, just add some fruit. i like homemade french or italian dressing on it.;['lettuce', 'cream cheese', 'blue cheese', 'carrots', 'green pepper', 'tomatoes', 'pepper', 'salt', 'onion'];9
1533;ruby glazed roast beef;13/02/2003;['weeknight', 'time-to-make', 'course', 'main-ingredient', 'cuisine', 'preparation', 'north-american', 'main-dish', 'beef', 'fruit', 'vegetables', 'canadian', 'oven', 'roast', 'dietary', 'one-dish-meal', 'ontario', 'meat', 'roast-beef', 'onions', 'equipment', 'presentation', 'served-hot', '4-hours-or-less'];"['preheat oven to 350 degrees', 'follow instructions on package of regular""oven bags""', 'combine first 4 ingredients', 'place roast in bag and pour jelly mixture over meat', 'insert meat thermometer through bag into centre of roast', 'cook roast in""oven bag"" placed in roaster for approximately 18 to 21 minutes per lb', 'for rare , 21 to 23 minutes per lb', 'for medium and 23 to 28 minutes per lb', 'for well done', 'slit bag open and remove roast', 'slice thinly across the grain and serve drizzled with juices from roast', 'if desired , juices may be thickened with mixture of 2 tbsps', 'each of cornstarch and cold water', 'if you don\'t have an""oven bag"" , brown roast on all sides in a large lightly oiled pot', 'add remaining ingredients and cook covered for at least 3 hours on stove top or in a 325 degree oven']";it's in the bag! for an easy way to prepare roasts that simplifies preparation and clean-up, try the special cellophane-like oven-safe ;['red currant jelly', 'green onion', 'soy sauce', 'ground ginger', 'beef blade roast'];5
4470;zucchini with pesto sauce;17/07/2002;['60-minutes-or-less', 'time-to-make', 'course', 'main-ingredient', 'cuisine', 'preparation', 'occasion', 'north-american', 'sauces', 'lunch', 'condiments-etc', 'side-dishes', 'pasta', 'vegetables', 'canadian', 'dinner-party', 'food-processor-blender', 'stove-top', 'dietary', 'low-sodium', 'gluten-free', 'low-carb', 'savory-sauces', 'free-of-something', 'low-in-something', 'pasta-rice-and-grains', 'squash', 'equipment', 'small-appliance'];['salt the zuke in a colander and allow to drain for 20 minutes', 'saute the zuke for 2 minutes', 'pesto sauce: put the basil , garlic and nuts in a food processor and pulverize the leaves', 'add oil and blend together', 'stir in the cheese', 'refrigerate the sauce until ready for use', 'add the pesto sauce to the sauted zucchini', 'season with salt& pepper and toss well to mix'];if you are not fond of basil substitute with spinach or parsley. great side dish with buttered pasta;['zucchini', 'salt & pepper', 'lite olive oil', 'basil leaves', 'garlic', 'pine nuts', 'olive oil', 'parmesan cheese'];8
4470;chunky chicken sauce for pasta for 2;03/06/2005;['30-minutes-or-less', 'time-to-make', 'course', 'main-ingredient', 'preparation', 'for-1-or-2', 'main-dish', 'easy', 'dietary', 'pasta-rice-and-grains', 'number-of-servings'];['put all the ingredients in a pot , except the cheese & pasta , bring to a simmer', 'pour over hot cooked pasta', 'top with parmesan and serve', 'enjoy'];this is a quick easy recipe start to finish 20 minutes using left over cooked chicken. i searched 15 pages of zaar recipes but could not find what i wanted so i made this one up. if you like a thinner sauce add 1/2 cup water.;['cooked chicken', 'tomatoes with herbs', 'garlic cloves', 'onions', 'chili flakes', 'parmesan cheese', 'cooked pasta'];7
5060;simple crunchy salad;30/01/2007;['15-minutes-or-less', 'time-to-make', 'course', 'main-ingredient', 'cuisine', 'preparation', 'occasion', 'north-american', 'lunch', 'salads', 'vegetables', 'canadian', 'easy', 'beginner-cook', 'dinner-party', 'dietary', 'comfort-food', 'british-columbian', 'greens', 'lettuces', 'peppers', 'tomatoes', 'brunch', 'taste-mood'];['wash romaine and spin dry , cut in bite sized pieces , not tooo small', 'slice all of the peppers into sticks', 'slice the tomato into small wedges', 'layer the lettuce and pepper sticks in a salad bowl , sprinkle with salt and pepper , mix', 'place tomato wedges around the the top', 'sprinkle to taste with salt and pepper', 'i serve it as is , if you prefer dressing , choose your favourite or put several choices on the table so each person can choose their favourite'];a quick throw together with lots of crunch!;['romaine lettuce', 'yellow sweet pepper', 'orange sweet bell pepper', 'red sweet pepper', 'green sweet pepper', 'tomatoes', 'sea salt', 'fresh ground pepper'];8
1533;crescent mushroom turnovers;10/06/2002;['60-minutes-or-less', 'time-to-make', 'course', 'main-ingredient', 'preparation', 'appetizers', 'lunch', 'eggs-dairy', 'vegetables', 'oven', 'easy', 'cheese', 'stove-top', 'dietary', 'mushrooms', 'equipment'];['preheat oven to 375 degrees', 'in a medium saucepan over medium heat , slowly cook and stir the mushrooms , parsley and onion in 2 tablespoons butter until tender', 'drain and set aside', 'separate the dough into 4 rectangles', 'cut rectangles in half , forming 8 squares , and arrange on a large baking sheet', 'place 1 tablespoon mushroom mixture on each square', 'top each square with 1 teaspoon parmesan cheese', 'fold the squares into triangles', 'in a small saucepan , melt remaining butter', 'brush triangles with butter and sprinkle with sesame seeds', 'bake in the preheated oven 10 to 15 minutes , until golden brown', 'serve warm'];these are great for a quick lunch on a busy day.;['fresh mushrooms', 'fresh parsley', 'onions', 'butter', 'crescent roll dough', 'parmesan cheese', 'sesame seeds'];7
5060;curried zucchini chowder;11/11/2002;['weeknight', 'time-to-make', 'course', 'main-ingredient', 'cuisine', 'preparation', 'occasion', 'north-american', 'lunch', 'main-dish', 'soups-stews', 'vegetables', 'canadian', 'easy', 'beginner-cook', 'diabetic', 'kid-friendly', 'vegan', 'vegetarian', 'winter', 'chowders', 'food-processor-blender', 'stove-top', 'dietary', 'spicy', 'seasonal', 'comfort-food', 'inexpensive', 'british-columbian', 'squash', 'taste-mood', 'equipment', 'small-appliance', 'number-of-servings', '4-hours-or-less'];['saute onion and garlic in margarine in large uncovered pot or dutch oven until onion is very soft and turning golden brown', 'stir in curry paste', 'saute for 1 minute', 'stir in remaining 7 ingredients', 'heat on medium , partially covered for 1 hour', 'remove and discard bay leaf', 'remove and reserve 2 cups soup', 'process remaining soup with hand blender or in batches in blender until smooth', 'combine reserved and pureed chowder'];nice mild curry flavour, add more if you like. swirl no fat yogurt, sour cream or cream into each serving, to mellow the curry flavour. from company's coming, cooking for diabetics. diabetic choices: 1 starch, 1/2 fruit and veggie each serving.;['onion', 'garlic', 'margarine', 'curry paste', 'zucchini', 'potatoes', 'water', 'vegetable stock powder', 'bay leaf', 'fresh ground pepper', 'ground cumin'];11
4470;ketjap manis plus stir fry beef;20/06/2005;['30-minutes-or-less', 'time-to-make', 'main-ingredient', 'cuisine', 'preparation', 'beef', 'asian', 'easy', 'dietary', 'meat', '3-steps-or-less'];['brown the beef in the oil for apprx 5 minutes', 'add remaining ingredients , stir well and simmer for 10 minutes', 'serve over noodles or rice'];"i was short of time and wanted a tasty easy quick dish - this worked for me i hope if you try it you will like it too. i served this over a bought kit of ""pad thai"", although not as good as home made pad thai it was delicious none the less";['stir-fry beef', 'ketjap manis', 'tomatoes', 'garlic flakes', 'dry onion flakes', 'hot sauce', 'oil'];7
1533;good ol  pumpkin pie;19/10/1999;['time-to-make', 'course', 'preparation', 'occasion', 'healthy', 'pies-and-tarts', 'desserts', 'oven', 'holiday-event', 'pies', 'dietary', 'thanksgiving', 'equipment', 'number-of-servings', '4-hours-or-less'];['combine sugar , spices and flour', 'add all other ingredients and beat until smooth', 'pour into unbaked pie shell', 'bake at 400 for 15 minutes', 'reduce oven temperature to 350 and bake another 45 minutes or until knife blade comes out clean when inserted in center of pie'];with the scrapes of dough if using homemade, decorate the top with it the last 20 minutes of cooking time.;['sugar', 'cinnamon', 'ginger', 'nutmeg', 'salt', 'flour', 'pumpkin', 'evaporated milk', 'eggs', 'margarine'];10
8688;spicy crab cakes;05/02/2008;['time-to-make', 'course', 'main-ingredient', 'preparation', 'main-dish', 'seafood', 'oven', 'crab', 'shellfish', 'equipment', '4-hours-or-less'];['preheat oven to 400 degrees f', 'in a large bowl mix together mayonnaise , both mustards , a generous dash of hot sauce , horseradish , and the egg', 'gently stir in the saltines and crabmeat', 'you may form the crabcakes immediately , however allowing the mixture to sit in the refrigerator for 1 hour will make the shaping easier', 'divide the mixture into 4-6 large crabcakes , and place on a lightly oiled or nonstick baking sheet', 'bake for 15-20 minutes , or until a light golden brown', 'serve immediately', 'variation:', 'baltimore crab cakes: add a dash of worcestershire sauce and old bay seasoning to taste'];to obtain best results, use jumbo lump crabmeat.  you can use regular, be sure it is fresh.  the juices add flavor, so please do not drain. cooking time reflects time to chill. from legal seafood.;['mayonnaise', 'dry mustard', 'dijon mustard', 'hot pepper sauce', 'horseradish', 'egg', 'saltine', 'fresh crabmeat'];8
8688;baked fish with mushrooms and cream;25/10/2002;['30-minutes-or-less', 'time-to-make', 'course', 'main-ingredient', 'preparation', 'for-1-or-2', 'very-low-carbs', 'main-dish', 'seafood', 'fish', 'stove-top', 'dietary', 'low-sodium', 'low-calorie', 'low-carb', 'low-in-something', 'saltwater-fish', 'orange-roughy', 'equipment', 'number-of-servings'];['preheat broiler', 'melt 2 tablespoons butter in heavy large skillet over medium-high heat', 'add mushrooms', 'saut until golden , about 7 minutes', 'add cognac', 'simmer until liquid reduces to glaze', 'reduce heat to medium', 'add tomatoes , cream and thyme', 'simmer until sauce thickens , stirring occasionally , about 7 minutes', 'season with salt and pepper', 'melt remaining 2 tablespoons butter in another heavy large skillet over medium-high heat', 'season fish with salt and pepper', 'add fish to skillet', 'saut until just cooked through , about 3 minutes per side', 'transfer fish to broiler-proof baking dish', 'spoon sauce over', 'sprinkle cheese over', 'broil until cheese melts , about 2 minutes'];i haven't made this recipe yet, but thought it looked pretty good! from bon appetit.;['butter', 'mushroom', 'cognac', 'crushed tomatoes', 'whipping cream', 'fresh thyme', 'orange roughy fillets', 'gruyere cheese'];8
4470;broccoli with orange   yogurt;16/04/2002;['30-minutes-or-less', 'time-to-make', 'course', 'main-ingredient', 'cuisine', 'preparation', 'occasion', 'north-american', 'low-protein', 'healthy', 'lunch', 'side-dishes', 'eggs-dairy', 'fruit', 'vegetables', 'canadian', 'easy', 'dinner-party', 'vegetarian', 'stove-top', 'dietary', 'low-sodium', 'low-cholesterol', 'low-calorie', 'low-carb', 'healthy-2', 'low-in-something', 'broccoli', 'equipment', '3-steps-or-less'];['melt the margarine and blend in the flour until smooth', 'gradually stir in the remaining ingredients', 'cook over low heat until the mixture thickens', 'serve over the hot broccoli'];some of you will want to cook the broccoli longer than the 5 minutes, but i like mine crisp. lovely smooth sauce that you may want to use on other veggies. not too bad on the calories either.;['broccoli florets', 'margarine', 'flour', 'fresh orange juice', 'plain yogurt', 'orange zest', 'dried thyme', 'salt & pepper'];8
3288;stromboli appetizers for a crowd;27/05/2004;['60-minutes-or-less', 'time-to-make', 'course', 'main-ingredient', 'cuisine', 'preparation', 'occasion', 'north-american', 'for-large-groups', 'appetizers', 'lunch', 'eggs-dairy', 'pork', 'american', 'oven', 'european', 'holiday-event', 'italian', 'cheese', 'new-years', 'oamc-freezer-make-ahead', 'independence-day', 'meat', 'superbowl', 'equipment', 'number-of-servings'];"['let dough rise until doubled , according to package directions', 'punch down', 'roll each loaf into 15"" x 12"" rectangle', 'arrange a fourth of the salami , ham , pepperoni and provolone cheese over each rectangle', 'sprinkle each with a fourth of the mozzarella cheese , romano cheese , garlic powder , oregano , parsley and pepper', 'roll up each rectangle jelly roll style beginning with the long side', 'seal seams and ends', 'place seam side down on two greased baking sheets', 'brush with egg yolk', 'bake at 375f for 25-30 minutes or until golden brown', 'let stand for 5 minutes before slicing', 'serve warm', 'refrigerate leftovers', 'good cold too !']";this is an easy to put together appetizer. cut down the portions for a smaller gathering or family meal!;['frozen bread dough', 'salami', 'deli ham', 'pepperoni', 'provolone cheese', 'mozzarella cheese', 'romano cheese', 'garlic powder', 'dried oregano', 'dried parsley flakes', 'pepper', 'egg yolk'];12
