chef_id;recipe_name;data;tags;steps;description;ingredients;n_ingredients
4470;hungarian goulash with sauerkraut;06/09/2001;['weeknight', 'time-to-make', 'course', 'main-ingredient', 'cuisine', 'preparation', 'occasion', 'casseroles', 'lunch', 'main-dish', 'beef', 'eggs-dairy', 'pasta', 'vegetables', 'hungarian', 'oven', 'european', 'dinner-party', 'dietary', 'comfort-food', 'meat', 'pasta-rice-and-grains', 'taste-mood', 'equipment', '4-hours-or-less'];['in a dutch oven heat oil and brown the meat on all sides , when browned set aside', 'add onions to the skillet , saute 5 minutes', 'pour off excess fat and return meat to the pot', 'sprinkle in the paprika and majoram', 'top with sauerkraut', 'bake covered for 1 hour 350f degrees oven', 'add salt', 'when ready to serve stir in the sour cream and caraway seeds', 'serve over hot buttered noodles'];there is goulash and there is goulash and there is this goulash, they are mostly all good but i find this one distinctive. the saurerkraut gives great flavor. do ahead and reheat the flavor is even better. i use wine cured kraut.;['lite olive oil', 'beef', 'pork', 'onions', 'hot paprika', 'dried marjoram', 'sauerkraut', 'sour cream', 'caraway seed', 'salt', 'noodles'];11
5060;neeps an tatties;21/01/2002;['30-minutes-or-less', 'time-to-make', 'course', 'main-ingredient', 'preparation', 'occasion', 'low-protein', 'healthy', 'lunch', 'main-dish', 'side-dishes', 'potatoes', 'vegetables', 'easy', 'beginner-cook', 'fall', 'heirloom-historical', 'holiday-event', 'kid-friendly', 'low-fat', 'winter', 'stove-top', 'dietary', 'low-sodium', 'low-cholesterol', 'seasonal', 'low-saturated-fat', 'low-calorie', 'comfort-food', 'inexpensive', 'healthy-2', 'low-in-something', 'taste-mood', 'equipment', '3-steps-or-less'];['cook the vegetables separtely , drain and then mash them together , adding all the other ingredients', 'season to taste and serve very hot'];"very good, i have substituted rutabegas for the turnip,many times, white turnip is not always available. my kids loved these as babbies and older,(omit chives/shallots for babbies).  as a matter of interest, a rutabega is not a turnip nor is a turnip a rutabega.  they are two different veggies often mistaken as the same. a turnip is white with a purple top and rutabega is yellow with a browish purple top, they each have their own flavour.  (i believe a ""sweede"" is a rutabega)";['potato', 'chives', 'turnips', 'butter', 'salt and pepper'];5
4470;ginger   orange rutabaga  yellow turnip or swede;20/02/2004;['30-minutes-or-less', 'time-to-make', 'course', 'main-ingredient', 'cuisine', 'preparation', 'occasion', 'north-american', 'low-protein', 'side-dishes', 'vegetables', 'canadian', 'easy', 'dinner-party', 'vegetarian', 'winter', 'dietary', 'low-sodium', 'low-cholesterol', 'seasonal', 'low-calorie', 'low-carb', 'inexpensive', 'healthy-2', 'low-in-something', 'presentation', '3-steps-or-less', 'technique'];['cover& cook the rutabaga until tender apprx 20 minutes', 'drain& mash , stir in remaining ingredients serve hot'];rutabagas are an under rated veggie - there are so many ways you can serve them - i love the touch of ginger with fresh orange juice used in this recipe. not bad for calories either;['rutabaga', 'ground ginger', 'fresh orange juice', 'butter', 'salt & pepper'];5
5060;savoury bread pudding;22/10/2001;['weeknight', 'time-to-make', 'course', 'main-ingredient', 'cuisine', 'preparation', 'occasion', 'north-american', 'breakfast', 'casseroles', 'lunch', 'main-dish', 'eggs-dairy', 'american', 'canadian', '1-day-or-more', 'oven', 'easy', 'holiday-event', 'kid-friendly', 'cheese', 'eggs', 'dietary', 'one-dish-meal', 'christmas', 'new-years', 'pacific-northwest', 'taste-mood', 'savory', 'equipment'];['grease 2 quart casserole', 'melt butter in a large frypan over medim heat', 'cook apples in butter 2-3 minutes , stirring occasionally , until crisp tender', 'stir in brown sugar , reduce heat to low', 'cook 5-6 minutes , stirring occasionally , until apples are tender', 'layer half of each of the bread , bacon apples and cheese in casserole', 'repeat with remaining bread , bacon , apples and cheese', 'mix remaining ingredients , pour over cheese', 'cover tightly and refrigerate at least 2 hours but no longer than 24 hours', 'heat oven to 350 degrees , bake uncovered 40-45 minutes or until knife inserted in centre comes out clean let stand 10 minutes before serving'];can be put together the night before ready to pop in the oven for breakfast. (i usually add 1/2 cup of chopped onions, cooked in with the apples)excellant for christmas breakfast buffet.;['butter', 'granny smith apples', 'brown sugar', 'bread', 'bacon', 'sharp cheddar cheese', 'milk', 'dry mustard', 'worcestershire sauce', 'salt', 'cayenne pepper', 'eggs'];12
1533;sauteed asparagus with red peppers   olives;17/07/2002;['30-minutes-or-less', 'time-to-make', 'course', 'main-ingredient', 'preparation', 'for-1-or-2', 'low-protein', 'healthy', 'side-dishes', 'vegetables', 'easy', 'diabetic', 'vegetarian', 'stove-top', 'dietary', 'low-sodium', 'low-cholesterol', 'low-saturated-fat', 'low-calorie', 'low-carb', 'healthy-2', 'low-in-something', 'asparagus', 'equipment', 'number-of-servings', '3-steps-or-less'];['in a large skillet , heat the oil over medium and add the onion , asparagus and the pepper and saute for about 2 minutes , or until the asparagus becomes tender', 'toss in the chopped olives and the lemon juice and cook another minute', 'serve immediately'];delicious as a side dish, this easy saute becomes a simple vegetarian entree tossed with pasta and sprinkled with cheese.;['extra virgin olive oil', 'red onion', 'fresh asparagus', 'red bell pepper', 'kalamata olive', 'lemon, juice of'];6
3288;indian lentils and rice soup;16/03/2002;['30-minutes-or-less', 'time-to-make', 'course', 'main-ingredient', 'cuisine', 'preparation', 'occasion', 'north-american', 'soups-stews', 'beans', 'rice', 'vegetables', 'american', 'asian', 'indian', 'vegetarian', 'stove-top', 'dietary', 'comfort-food', 'lentils', 'pasta-rice-and-grains', 'taste-mood', 'equipment'];['spray 3-quart saucepan with nonstick cooking spray', 'cook green onions , gingerroot , red pepper and garlic in saucepan over medium heat 3 to 5 minutes , stirring occasionally , until onions are tender', 'stir in 5 cups of the broth , the lentils , turmeric and salt', 'heat to boiling', 'reduce heat', 'cover and simmer about 25 to 30 minutes , adding remaining stock if needed , until lentils are tender', 'stir in tomato , coconut and mint', 'serve over rice with yogurt'];from start to finish, you can have lentil soup in less than 30 minutes. i have to say my daughter doesn't enjoy the mint and coconut in it so we serve hers without!;['green onions', 'gingerroot', 'crushed red pepper flakes', 'garlic', 'vegetable broth', 'dried lentils', 'ground turmeric', 'salt', 'tomatoes', 'coconut', 'of fresh mint', 'cooked rice', 'plain nonfat yogurt'];13
3288;tish s crock pot corned beef and cabbage;22/02/2002;['weeknight', 'time-to-make', 'course', 'main-ingredient', 'cuisine', 'preparation', 'occasion', 'north-american', 'main-dish', 'beef', 'vegetables', 'american', 'holiday-event', 'crock-pot-slow-cooker', 'dietary', 'comfort-food', 'st-patricks-day', 'meat', 'taste-mood', 'equipment'];['place onions in slow cooker', 'place corned beef with carrots on top', 'mix together apple juice , brown sugar , orange peel , cloves , garlic , mustard and pour over top', 'add water or additional apple juice if needed to cover the top of the beef', 'cover and cook low 8-10 hours or high for 5-6 hours', 'place cabbage on top the last 3 hours , pushing down to moisten', 'turn on high and cook until cabbage is done', 'serve with horseradish on the side'];a whole meal...easy to put together and come home to.;['onions', 'carrots', 'corned beef brisket', 'apple juice', 'water', 'brown sugar', 'orange rind', 'cloves', 'garlic cloves', 'prepared mustard', 'cabbage', 'horseradish'];12
8688;jamaican crawler cocktail;22/01/2008;['15-minutes-or-less', 'time-to-make', 'course', 'preparation', 'for-1-or-2', '5-ingredients-or-less', 'beverages', 'easy', 'cocktails', 'number-of-servings', '3-steps-or-less'];['combine rum , melon liqueur and pineapple juice with ice', 'stir well', 'pour into collins glass', 'float splash of grenadine on top'];the fresh flavor of melon and pineapple come together to create this tasty cocktail.  from mr. boston.;['light rum', 'melon liqueur', 'pineapple juice', 'grenadine'];4
5060;curried crab cakes;31/12/2001;['60-minutes-or-less', 'time-to-make', 'course', 'main-ingredient', 'cuisine', 'preparation', 'occasion', 'north-american', 'appetizers', 'lunch', 'main-dish', 'side-dishes', 'seafood', 'canadian', 'easy', 'potluck', 'dinner-party', 'finger-food', 'holiday-event', 'romantic', 'winter', 'easter', 'crab', 'stove-top', 'dietary', 'new-years', 'seasonal', 'valentines-day', 'shellfish', 'taste-mood', 'to-go', 'equipment', 'number-of-servings', 'presentation'];['combine first 5 ingredients in a small bowl , stir well', 'heat a large nonstick frypan coated with cooking spray over medium high heat', 'add onion , bell pepper , and celery , cover , reduce heat to medium low and cook for 10 minutes , stirring occasionally', 'add the curry powder mixture , ginger and garlic , cook , uncovered , 5 minutes , stirring frequently', 'spoon mixture into a large bowl , cool', 'wipe frypan clean with a paper towel', 'add 3 / 4 cup breadcrumbs , mayonnaise , rind , crabmeat and egg to onion mixture , stir well', 'divide crabmeat mixture into 24 equal portions , shaping each into 1 / 2 inch thick patty', 'place remaining breadcrumbs in a shallow dish , dredge each crab cake in breadcrumbs', 'melt 2 teaspoons butter in pan over medium heat', 'add 8 patties and cook 2 minutes on each side or until browned', 'remove the crab cakes from pan , and keep warm', 'repeat procedure with remaining butter and patties', 'garnish with parsley sprigs'];excellent appetizer, lots of taste. from cooking light.;['curry powder', 'salt', 'dry mustard', 'black pepper', 'cayenne pepper', 'cooking spray', 'onion', 'red bell pepper', 'celery', 'ginger', 'garlic clove', 'dry breadcrumbs', 'mayonnaise', 'fresh lemon rind', 'lump crabmeat', 'egg', 'butter', 'parsley sprig'];18
5060;pastiera with strawberry sauce    easter ricotta cake;18/03/2005;['time-to-make', 'course', 'main-ingredient', 'preparation', 'occasion', 'for-large-groups', 'desserts', 'eggs-dairy', 'dinner-party', 'holiday-event', 'cakes', 'easter', 'cheese', 'eggs', 'brunch', 'number-of-servings', '4-hours-or-less'];"['bring milk to a boil in a large sauce pan over medium high heat', 'stir in rice , cinnamon , salt and vanilla bean', 'reduce heat to medium low , cook , stirring occasionally with a wooden spoon , until rice is very tender and has absorbed all liquid , about 30 minutes', 'remove pan from heat , stir in 3 / 4 cup granulated sugar , cover , let cool , stirring occasionally', 'discard vanilla bean', 'preheat oven to 350f degrees', 'butter and flour an 8-inch springform pan', 'in a large bowl , fold together , the rice mixture , ricotta , whole eggs and egg yolks , and remaining 1 / 2 cup sugar , very carefully using a rubber spatula', 'pour into prepared pan', 'bake until golden , 65 to 70 minutes , cover with foil if starting to brown too much', 'transfer pan to cooling rack', 'when cake has cooled completely , run a knife around edge to loosen', 'gently remove ring', 'transfer cake to a serving plate', ""sprinkle with confectioners' sugar , and serve at room temperature with sauce"", 'sauce:', 'combine all ingredients in a medium nonreactive saucepan', 'cook over medium low heat , stirring occasionally , until berries are soft , 5 to 7 minutes', 'serve warm or at room temperature']";i hunted through a dozen pages of recipes to make sure this was not duplicating, couldn't find one like it. this is an incredible cake--light, creamy-like custard, flavoured lightly with vanilla, all in one. the perfect easter pastiera, originally from martha stewart living.;"['whole milk', 'arborio rice', 'ground cinnamon', 'coarse salt', 'vanilla bean', 'granulated sugar', 'unsalted butter', 'all-purpose flour', 'ricotta cheese', 'eggs', 'egg yolks', ""confectioners' sugar"", 'fresh strawberries', 'sugar', 'fresh lemon juice']";15
8688;summer vegetable succotash;02/04/2002;['60-minutes-or-less', 'time-to-make', 'course', 'main-ingredient', 'preparation', 'occasion', 'side-dishes', 'vegetables', 'summer', 'stove-top', 'dietary', 'low-sodium', 'seasonal', 'low-calorie', 'low-in-something', 'equipment'];['cover potatoes with cold salted water by 1 inch in a large saucepan', 'bring to a boil , then reduce heat and simmer until potatoes are just tender , about 20 minutes', 'drain and cool , then cut into bite-size pieces', 'heat oil and 1 tablespoon butter in a well-seasoned 10-inch cast-iron skillet over high heat until foam subsides , then saut potatoes with salt and pepper to taste , turning once or twice , until nicely crusted , 8 to 10 minutes', 'transfer to a serving bowl', 'saut corn and squash in remaining 3 tablespoons butter in skillet over moderately high heat , stirring , until crisp-tender , about 5 minutes', 'stir in beans and saut , stirring , until heated through', 'season with salt and pepper and add to potatoes with onion and chives , stirring to combine'];from gourmet magazine;['potato', 'vegetable oil', 'unsalted butter', 'fresh corn kernels', 'squash', 'edamame', 'red onion', 'fresh chives'];8
8688;ratatouille  crock pot;04/04/2003;['time-to-make', 'course', 'main-ingredient', 'cuisine', 'preparation', 'main-dish', 'vegetables', 'french', 'european', 'vegan', 'vegetarian', 'stews', 'crock-pot-slow-cooker', 'dietary', 'onions', 'peppers', 'squash', 'equipment', 'presentation', 'served-cold', 'served-hot', '4-hours-or-less'];['sprinkle the eggplant with salt', 'let stand in a colander 1 / 2- 1 hour to drain', 'press out excess moisture', 'rinse the eggplant with water and pat dry with paper towels', 'place the eggplant in crock pot', 'add onions , tomatoes , bell peppers , zucchini , olive oil , basil , garlic , pepper and 1 / 2 tsp salt', 'mix well', 'cover and cook on high setting about 3 hours or until the vegetables are tender but still hold their shape', 'stir in the tomato paste , olives , and the fresh basil', 'serve hot , room temperature or chilled'];make a whole meal out of the french vegetarian classic while it is warm or offer it chilled as a salad course. serve with a crusty bread and top with feta cheese, if desired. from the best slow cooker cookbook ever.;['eggplant', 'salt', 'onions', 'fresh tomatoes', 'green bell pepper', 'red bell peppers', 'zucchini', 'olive oil', 'dried basil', 'garlic cloves', 'fresh ground pepper', 'tomato paste', 'pitted ripe olives', 'fresh basil'];14
5060;pork tenderloin flambe with pears;01/10/2001;['60-minutes-or-less', 'time-to-make', 'course', 'main-ingredient', 'cuisine', 'preparation', 'occasion', 'north-american', 'main-dish', 'fruit', 'pork', 'american', 'canadian', 'easy', 'dinner-party', 'holiday-event', 'romantic', 'stove-top', 'dietary', 'pacific-northwest', 'pears', 'meat', 'taste-mood', 'equipment'];['cut tenderloins into 1 1 / 2 inch lengths flatten each slice slightly with heel of hand sprinkle salt over the bottom of a heavy frypan and place over moderately high heat', 'when salt is hot , add meat reduce heat to moderately low and brown , about 15 minutes turn and brown on the other side , 10 minutes add butter and let melt mix lemon juice , worcestershire sauce and tabasco , pour over meat heat brandy in a small saucepan , ignite with a match , be careful of eye lashes and hair !', 'quickly pour over meat and rotate gently until flames die down', 'cover and simmer 5 minutes over low heat', 'arrange pears around meat and baste with sauce cover and cook 5 minutes longer'];this is a really fun party dish, everybody wants into the act. you will have an audience, with a lot of kibitzing to flambe and the bonus is that it is a delicious impressive dish!! one of our favourite dinner parties. serve with asparagus, and boiled/buttered/parselied baby potatoes.;['pork tenderloin', 'salt', 'butter', 'fresh lemon juice', 'worcestershire sauce', 'tabasco sauce', 'brandy', 'pears'];8
5060;pacific salmon pie;13/03/2002;['weeknight', 'time-to-make', 'course', 'main-ingredient', 'cuisine', 'preparation', 'occasion', 'north-american', 'main-dish', 'eggs-dairy', 'rice', 'seafood', 'canadian', 'oven', 'easy', 'diabetic', 'kid-friendly', 'salmon', 'fish', 'cheese', 'dietary', 'inexpensive', 'british-columbian', 'pasta-rice-and-grains', 'saltwater-fish', 'equipment', '4-hours-or-less'];['bring water and salt to a boil , add rice , bring to boil again , cover , reduce heat and simmer about 15 minutes , until all water is absorbed and rice is tender', 'grease a 9 inch pie plate with 1 teaspoon margarine', 'melt remaining margarine in a fry pan', 'saut celery and onion about 4 minutes until tender', 'beat 1 egg with pepper and mix into rice', 'press rice onto bottom and sides of prepared pie plate to form crust', 'sprinkle half the cheese over rice', 'spread with half the celery mixture and salmon', 'top with remaining celery mixture and cheese', 'beat together remaining egg , milk , nutmeg , curry powder and cinnamon', 'pour over ingredients in pie plate', 'bake in 375 degree oven for 30 to 35 minutes until a tester inserted in the centre comes out clean', 'cool 5 minutes', 'cut into 6 wedges', 'diabetic- 1 wedge', '2 protein choices', '1 starchy choice', '1 fats and oils choice'];"dh says ""it's good"" (and it is). good hot or cold. from canadian diabetes association";['water', 'salt', 'long grain rice', 'margarine', 'celery', 'onion', 'eggs', 'fresh ground pepper', 'swiss cheese', 'salmon', '2% low-fat milk', 'nutmeg', 'curry powder', 'cinnamon'];14
3288;honey   cracker jack;25/03/2003;['30-minutes-or-less', 'time-to-make', 'course', 'cuisine', 'preparation', 'occasion', 'north-american', '5-ingredients-or-less', 'lunch', 'snacks', 'american', 'oven', 'easy', 'beginner-cook', 'finger-food', 'holiday-event', 'kid-friendly', 'picnic', 'stove-top', 'dietary', 'low-sodium', 'brown-bag', 'inexpensive', 'low-in-something', 'superbowl', 'taste-mood', 'sweet', 'to-go', 'equipment', 'presentation'];['heat honey and butter in a saucepan until blended', 'cool', 'pour over popcorn which has been mixed with peanuts , stirring as you pour', 'when well coated , spread in a pan in a single layer', 'bake at 350f for 5-10 minutes or until crisp , stirring several times', '(the difference between crisp and burnt can be a matter of minutes) package in plastic bags with twist tie or zipper top', 'foodcoloring added to honey gives a festive appearance'];this is a great addition to the after school snack, lunch box, or snack to put out for a gathering.;['honey', 'popped corn', 'peanuts', 'butter'];4
3288;all american jello salad;05/03/2002;['weeknight', 'time-to-make', 'course', 'main-ingredient', 'cuisine', 'preparation', 'occasion', 'north-american', 'low-protein', 'healthy', 'gelatin', 'desserts', 'lunch', 'salads', 'fruit', 'american', 'easy', 'no-cook', 'potluck', 'kid-friendly', 'low-fat', 'picnic', 'summer', 'dietary', 'low-sodium', 'low-cholesterol', 'seasonal', 'low-saturated-fat', 'low-calorie', 'low-in-something', 'tropical-fruit', 'pineapple', 'to-go', 'technique', '4-hours-or-less'];['in a large bowl , combine dry gelatins and water', 'mix well to dissolve gelatin', 'stir in undrained pineapple', 'add frozen blueberries and raspberries', 'mix well to combine fold in bananas', 'pour mixture into an 8x8 dish', 'refrigerate until firm', 'cut and serve'];it's fun to mix jello flavors. because it kind of red, white and blue you might consider this salad for a summer gathering as well as just everyday kid stuff;['raspberry gelatin powder', 'berry blue gelatin mix', 'boiling water', 'crushed pineapple', 'unsweetened blueberries', 'unsweetened raspberry', 'banana'];7
5060;sunflower fruit cole slaw;20/10/2001;['15-minutes-or-less', 'time-to-make', 'course', 'main-ingredient', 'cuisine', 'preparation', 'occasion', 'north-american', 'salads', 'side-dishes', 'fruit', 'vegetables', 'american', 'canadian', 'easy', 'no-cook', 'refrigerator', 'potluck', 'dinner-party', 'fall', 'holiday-event', 'kid-friendly', 'picnic', 'spring', 'summer', 'winter', 'dietary', 'seasonal', 'pacific-northwest', 'tropical-fruit', 'pineapple', 'to-go', 'equipment', 'technique'];['in a large bowl , combine oranges , pineapple , cabbage , carrots and sunflower seeds , mix lightly', 'in a small bowl , stir together mayonnaise , lemon juice , salt and pepper', 'pour over salad mixture , tossing to coat', 'cover and refrigerate at least 1 hour until well chilled'];great for a potluck or family get together;['mandarin orange segments', 'crushed pineapple', 'cabbage', 'carrot', 'sunflower seeds', 'mayonnaise', 'lemon juice', 'salt', 'cayenne pepper'];9
3288;freeze ahead italian pasta salad;13/02/2003;['30-minutes-or-less', 'time-to-make', 'course', 'main-ingredient', 'cuisine', 'preparation', 'occasion', 'north-american', 'healthy', 'main-dish', 'salads', 'side-dishes', 'pasta', 'vegetables', 'american', 'potluck', 'low-fat', 'picnic', 'spring', 'summer', 'stove-top', 'dietary', 'one-dish-meal', 'low-cholesterol', 'seasonal', 'low-saturated-fat', 'low-calorie', 'oamc-freezer-make-ahead', 'inexpensive', 'healthy-2', 'low-in-something', 'pasta-rice-and-grains', 'to-go', 'equipment', 'number-of-servings', 'presentation', 'served-cold'];['cook rotini per package directions', 'if using fresh broccoli , add it to the cooking pasta for the last two minutes', 'rinse pasta in cold water', 'open cans of beans , olives , artichoke hearts and mushrooms and drain them', 'cut artichoke hearts into sixths , or smaller if you prefer', 'mix pasta , broccoli , beans , olives , artichoke hearts , mushrooms and green onions in a large bowl', 'add salad dressing and stir to mix', 'to freeze: divide into freezer bags , based on the size of your family , and if youll serve this as a side dish or a main dish', 'seal , label and freeze', 'to serve: thaw bag in refrigerator for 24 hours', 'shake the bag a few times before serving', 'add any of the optional ingredients , stir and serve', 'since this dish is served cold , and the pasta isnt re-heated , dont under-cook it', 'cook it al dente per package directions', 'some of the salad dressing will be absorbed by the salad while its frozen', 'you may need to add a fresh shake or two of dressing before serving , especially if you add any extra ingredients'];this recipe is adapted from sue gregg's cookbook. this recipe goes together fast. add fresh vegetables on serving day, based on what you have on hand... tomatoes, bell peppers, cucumbers, etc. if desired.;['rotini pasta', 'broccoli', 'kidney beans', 'black olives', 'artichoke hearts', 'mushrooms', 'green onions', 'salad dressing', 'tuna fish', 'chicken', 'parmesan cheese', 'cheese'];12
1533;artichoke heart dip;23/11/1999;['30-minutes-or-less', 'time-to-make', 'course', 'main-ingredient', 'cuisine', 'preparation', 'occasion', 'north-american', 'appetizers', 'vegetables', 'american', 'oven', 'dinner-party', 'dips', 'dietary', 'equipment', 'number-of-servings'];['cut artichoke hearts into small pieces', 'mix all ingredients together except paprika', 'put into baking dish and sprinkle paprika on top for color', 'bake at 350 degrees f for 20 minutes or until bubbly', 'serve with crackers or baguette thins'];people usually rave about this one!;['mayonnaise', 'parmesan cheese', 'water-packed artichoke hearts', 'garlic powder', 'paprika'];5
4470;bbq d cornmeal crust pizza with artichokes;25/05/2002;['60-minutes-or-less', 'time-to-make', 'course', 'main-ingredient', 'cuisine', 'preparation', 'occasion', 'north-american', 'lunch', 'main-dish', 'eggs-dairy', 'vegetables', 'canadian', 'barbecue', 'dinner-party', 'pizza', 'cheese', 'dietary', 'equipment', 'grilling'];"['stir together the whole wheat , white flour and cornmeal , add baking soda and baking powder', 'combine yogurt with the oil , pour over the flour mixture , stirring it with a fork- be gentle', 'on a well floured surface knead the mixture', 'ightly into a ball cover and let stand while you prepare the topping', 'roll out the dough to 1 / 4"" thickness', 'transfer to a 12"" greased pizza pan', 'sprinkle 1 1 / 2 cups of the cheese right on the dough and right to the edge', 'top with tomatoes , artichokes and olives', 'sprinkle remaining cheese on top', 'have bbq medium hot and place pan 5-6"" above the heat , close cover', 'rotate the pan every 3 minutes for 10-15 minutes or until the crust is crisp& golden and the cheese is melted sprinkle with the fresh basil']";this is what i call a sophisticated adult pizza! wonderful subtle taste. if you are not too fond of basil don't use it but i think it makes this pizza, if you can't get provolone cheese use all mozzarella serve with a green salad;['whole wheat flour', 'white flour', 'cornmeal', 'baking powder', 'baking soda', 'salt', 'dry basil', 'plain yogurt', 'lite olive oil', 'tomatoes', 'marinated artichoke hearts', 'black olives', 'green onions', 'mozzarella cheese', 'provolone cheese', 'fresh basil'];16
